Business Area,SQL Finding
Overall Profitability,Overall profit margin is 11.61%.
Loss-Making Transactions,24.46% of order lines are loss-making.
Product Category,The most profitable category is Technology.
Sub-Category Risk,The weakest sub-category by profit is Tables.
Market Performance,The most profitable market is APAC.
Market Performance,The weakest market by profit is Canada.
Discount Strategy,The best discount band by margin is No discount.
Discount Strategy,The worst discount band by margin is Extreme discount.
